{
  "id": "doc:hse:00823",
  "type": "Document",
  "documentType": "Regulatory approval",
  "name": "Tepotinib Therapy. NCCP National SACT Regimen. HSE.",
  "title": null,
  "aliases": [],
  "description": "Tepotinib Therapy, 2025, version number 2, NCCP National SACT Regimen, NCCP, viewed 26/03/2026, https://healthservice.hse.ie/documents/6868/823_V2_Tepotinib_Therapy.pdf",
  "urls": [
    "https://healthservice.hse.ie/documents/6868/823_V2_Tepotinib_Therapy.pdf"
  ],
  "doi": null,
  "pmid": null,
  "extensions": [
    {
      "name": "agent",
      "value": {
        "id": "agent:org:hse",
        "type": "Agent",
        "agentType": "organization",
        "name": "Health Service Executive",
        "description": "Regulatory agency that approves medicines for reimbursement by the public health system in the Republic of Ireland."
      },
      "description": "The organization that published this document."
    },
    {
      "name": "company",
      "value": "",
      "description": "The company that manufactures the cancer drug. Only applicable to market authorization documents."
    },
    {
      "name": "drug_name_brand",
      "value": null,
      "description": "The brand name of the cancer drug, per this document. Only applicable to market authorization documents."
    },
    {
      "name": "drug_name_generic",
      "value": null,
      "description": "The generic name of the cancer drug, per this document. Only applicable to market authorization documents."
    },
    {
      "name": "first_publication_date",
      "value": null,
      "description": "The publication date for the initial version of this document."
    },
    {
      "name": "publication_date",
      "value": "2024-08-01",
      "description": "The publication date for the document."
    },
    {
      "name": "regulatory_identifier",
      "value": null,
      "description": "Identifier assigned by the regulatory agency, such as an FDA application number (e.g. NDA208716, BLA125427) or an EMA product number (e.g. EMEA/H/C/006184)."
    },
    {
      "name": "status",
      "value": "Active",
      "description": "Whether this document is Active or Deprecated within moalmanac-db."
    }
  ]
}